Disease,Description,Symptoms ,Precautions,Medications,Diets
Essential thrombocythemia,"A rare condition causing episodes of burning pain, warmth, and redness in the hands and feet, often triggered by heat or exertion.","Burning pain, redness, warmth, swelling, particularly in hands and feet.","Avoid heat, elevate affected limbs, manage stress.","Pain management (NSAIDs, gabapentin), cooling therapy, vasodilators in severe cases."," Focus on a heart-healthy diet: fruits, vegetables, whole grains, lean protein.- Limit saturated fats and sugar."
Fabry disease,"A rare blood disorder where the bone marrow produces too many platelets, leading to an increased risk of blood clots or bleeding.","Headaches, dizziness, fatigue, vision changes, tingling in hands and feet, bleeding or clotting.","Regular monitoring, avoid smoking, maintain a healthy lifestyle.","Aspirin, hydroxyurea, anagrelide to lower platelet count, blood thinners for clot prevention.","- Low-fat, high-fiber diet; avoid high-fat dairy and meat products.- Stay hydrated; may benefit from low-sugar options."
Factor V Leiden,"A genetic disorder caused by the buildup of a specific type of fat (GL-3) in the body's cells, affecting the heart, kidneys, skin, and nervous system.","Pain, burning sensations in hands and feet, skin rash, kidney problems, heart complications, fatigue.","Genetic counseling, regular monitoring, avoid extreme temperatures.","Enzyme replacement therapy, pain relievers, kidney and heart care medications, gene therapy (in development).","- Balanced diet rich in fruits, vegetables, and whole grains.- Maintain hydration; consider vitamin K intake in moderation."
Farber disease,"A genetic disorder that increases the risk of developing abnormal blood clots in veins, such as deep vein thrombosis (DVT) or pulmonary embolism.","Swelling, pain, warmth in the legs (DVT), shortness of breath, chest pain (PE), prolonged bleeding in severe cases.","Regular monitoring, avoid smoking, manage blood pressure and weight.","Blood thinners (warfarin, heparin), aspirin in low-risk cases, clot-busting drugs for emergencies.", Nutrient-dense foods to support overall health.Maintain hydration; avoid processed foods high in fats and sugars.
Fifth disease (Parvovirus infection),"A rare genetic disorder that leads to the accumulation of fatty substances in the body's tissues and organs, particularly affecting joints and lungs.","Joint stiffness, difficulty breathing, nodules under the skin, hoarse voice.","Genetic counseling, regular monitoring, manage symptoms early.","Enzyme replacement therapy (in development), anti-inflammatory drugs, surgery to remove nodules.","Stay hydrated; nutrient-dense foods for recovery (fruits, vegetables, lean proteins)."
Focal segmental glomerulosclerosis,"A common viral infection caused by parvovirus B19, typically affecting children and causing a ""slapped cheek"" rash.","Red rash on the cheeks, fever, fatigue, joint pain (in adults), cold-like symptoms.","Maintain good hygiene, avoid close contact with infected individuals.","Supportive care (rest, hydration), NSAIDs for fever and joint pain.","Low-protein diet to reduce kidney strain, focus on high-quality protein sources.Low-sodium diet to manage blood pressure and fluid retention."
Follicular lymphoma,"A type of kidney disease that causes scarring in the glomeruli, leading to protein loss in urine and eventual kidney failure.","Proteinuria (protein in urine), swelling (edema), high blood pressure, fatigue, decreased kidney function.","Regular monitoring, maintain a healthy diet, manage blood pressure.","Corticosteroids, immunosuppressants, diuretics, dialysis or kidney transplant in severe cases.","Anti-inflammatory diet rich in fruits, vegetables, whole grains, and healthy fats. Limit processed foods, sugar, and red meat."
Friedreich’s ataxia,"A slow-growing type of non-Hodgkin's lymphoma that affects the lymph nodes and bone marrow, causing painless swelling.","Swollen lymph nodes, fatigue, weight loss, night sweats, fever.","Regular check-ups, avoid smoking, maintain a healthy lifestyle.","Chemotherapy, radiation therapy, targeted therapy (rituximab), bone marrow transplant in severe cases.","Nutrient-dense diet to support energy needs; focus on whole foods. Adequate hydration, fiber-rich foods to prevent constipation."
Frontotemporal dementia,"A rare inherited disorder that causes progressive damage to the nervous system, leading to movement problems and heart disease.","Difficulty walking, loss of coordination, muscle weakness, vision and hearing loss, heart palpitations.","Genetic counseling, physical therapy, regular monitoring.","No specific cure, physical therapy, speech therapy, surgery for scoliosis, heart medications (beta-blockers, ACE inhibitors)."," Diet rich in omega-3 fatty acids (fish, flaxseeds), antioxidants (berries, green leafy vegetables). Limit refined sugars and saturated fats."
Galactosemia,"A group of brain disorders that primarily affect the frontal and temporal lobes, leading to changes in personality, behavior, and language abilities.","Personality changes, apathy, language difficulties, impulsivity, memory loss (in later stages).","Regular monitoring, early diagnosis, cognitive therapy.","No specific cure, medications to manage symptoms (antidepressants, antipsychotics), speech and occupational therapy."," Strict avoidance of all foods containing galactose (dairy products, certain legumes). Calcium and vitamin D supplements are essential."
Gastric varices,"A rare genetic disorder that affects the body’s ability to process galactose, a sugar found in dairy products, leading to harmful buildup in the body.","Poor feeding, vomiting, lethargy, jaundice, intellectual disability (if untreated).","Avoid dairy products, genetic counseling, early diagnosis.","Lactose-free diet, calcium and vitamin D supplements, regular monitoring for complications.", Low-sodium diet to prevent fluid retention; nutrient-rich foods for overall health. Avoid alcohol and spicy foods.
Gastroesophageal cancer,"Cancer of the esophagus or stomach, often diagnosed at an advanced stage.","Difficulty swallowing, weight loss, indigestion, nausea, abdominal pain, black or bloody stools.","Regular check-ups, report persistent symptoms to a healthcare provider.","Chemotherapy (cisplatin, carboplatin), targeted therapies (trastuzumab), radiation therapy.","- Small, frequent meals; focus on soft foods if swallowing is difficult.
- Nutrient-dense foods rich in protein and vitamins (smoothies, soups)."
Gaucher’s disease,"Genetic disorder due to a deficiency of the enzyme glucocerebrosidase, leading to fatty substance accumulation in organs.","Enlarged spleen and liver, bone pain, fatigue, bruising, anemia, neurological symptoms in some types.","Regular monitoring, genetic counseling, avoid strenuous activities if experiencing bone pain.","Enzyme replacement therapy (imiglucerase, velaglucerase alfa), substrate reduction therapy (eliglustat).","- Balanced diet with adequate healthy fats, proteins, and carbohydrates.
- Nutrient-rich foods to support overall health; limit refined sugars."
Glanzmann’s thrombasthenia,"A rare inherited bleeding disorder where platelets cannot aggregate properly, leading to excessive bleeding.","Easy bruising, frequent nosebleeds, heavy menstrual periods, prolonged bleeding after cuts or dental work.",Inform healthcare providers about the condition before surgeries or dental procedures; avoid medications that affect platelet function.,"Platelet transfusions, antifibrinolytics, desmopressin in some cases, supportive care for bleeding episodes.","- Nutrient-dense foods to support blood health (iron-rich foods).
- Avoid foods that increase bleeding risk (high doses of vitamin E, certain herbs)."
Glaucoma,"A group of eye conditions that damage the optic nerve, often associated with increased pressure in the eye, potentially leading to vision loss.","Loss of peripheral vision, blurred vision, headache, eye pain, halos around lights.",Regular eye exams for early detection; adhere to prescribed medications to manage eye pressure.,"Eye drops to lower intraocular pressure (prostaglandin analogs, beta-blockers), oral medications, and surgery in severe cases.","Eat foods rich in antioxidants (fruits, vegetables) to support eye health. Omega-3 fatty acids (fish, flaxseeds) may also be beneficial."
Glossopharyngeal neuralgia,"A rare condition characterized by severe, sudden pain in the throat, tongue, ear, and tonsils due to irritation of the glossopharyngeal nerve.","Severe pain in the throat, ear, and tongue, often triggered by swallowing, talking, or yawning; episodes can be brief but intense.","Identify and avoid triggers (e.g., certain foods, swallowing hard foods); consult with a healthcare professional for pain management strategies.","Anticonvulsants (carbamazepine), surgery may be needed in severe cases.",Maintain a soft diet to avoid triggering pain; stay hydrated. Anti-inflammatory foods may help manage symptoms.
Goodpasture’s syndrome," Syndrome	An autoimmune disorder characterized by the presence of antibodies against the basement membrane in the lungs and kidneys, leading to lung hemorrhage and kidney failure.","Fatigue, hemoptysis (coughing up blood), shortness of breath, kidney dysfunction symptoms (swelling, high blood pressure, changes in urine).",Early detection and treatment are crucial; regular monitoring of kidney function.,"Corticosteroids, immunosuppressants, plasmapheresis in severe cases.",A balanced diet that supports kidney health: low in sodium and protein if kidney function is impaired; adequate hydration.
Gorlin syndrome,"	A genetic condition causing skin lesions, jaw cysts, and an increased risk of various cancers, particularly basal cell carcinoma.","Skin tumors (basal cell carcinomas), jaw cysts, skeletal abnormalities, increased risk of other cancers.",Regular skin examinations and screenings for cancers; avoid excessive sun exposure.,Surgical removal of tumors; regular monitoring; topical chemotherapy for skin lesions.,"A diet rich in antioxidants (fruits, vegetables) to help support skin health; consider supplements for bone health as advised by a healthcare provider."
Granulomatosis with polyangiitis (Wegener's granulomatosis),"An autoimmune disease characterized by inflammation of blood vessels (vasculitis) that can affect multiple organs, primarily the lungs and kidneys.","Respiratory symptoms (cough, hemoptysis), kidney dysfunction, fever, weight loss, fatigue, sinusitis.",Early diagnosis and treatment are crucial; avoid infections due to immunosuppressive therapy.,"Corticosteroids, immunosuppressants (cyclophosphamide, rituximab), supportive therapies.",Focus on a nutrient-rich diet to support overall health; stay hydrated; avoid foods that may increase inflammation.
Graves' disease,"An autoimmune disorder that results in overactivity of the thyroid gland (hyperthyroidism), leading to excess production of thyroid hormones","Anxiety, irritability, weight loss, increased appetite, sweating, heat intolerance, tremors, bulging eyes (exophthalmos).",Regular monitoring of thyroid levels; avoid excessive iodine intake; manage stress levels.,"Antithyroid medications (methimazole, propylthiouracil), beta-blockers for symptom relief, radioactive iodine therapy, or surgery in severe cases.","A well-balanced diet; consider a diet low in iodine (limit iodized salt, seaweed, and certain fish); focus on whole foods to support overall health."
Haemochromatosis,"A genetic condition causing excessive iron absorption, leading to iron overload in the body, which can damage organs.","Fatigue, joint pain, abdominal pain, skin discoloration (bronze skin), diabetes, liver dysfunction.","Avoid iron supplements; limit vitamin C intake, which increases iron absorption; regular monitoring of iron levels.","Phlebotomy (regular blood removal), iron chelation therapy, dietary modifications.","Avoid iron-rich foods (red meat, liver), limit vitamin C intake with meals; focus on a diet rich in fruits, vegetables, and whole grains to support overall health."
Hantavirus pulmonary syndrome,"A severe respiratory disease caused by hantavirus, transmitted primarily through contact with infected rodents.","Fever, muscle aches, fatigue, coughing, shortness of breath, low blood pressure.",Avoid contact with rodents and their droppings; maintain cleanliness in homes and avoid places where rodents may inhabit.,Avoid contact with rodents and their droppings; maintain cleanliness in homes and avoid places where rodents may inhabit.,Supportive care for respiratory symptoms; no specific antiviral treatment available.
Harlequin ichthyosis,"A severe genetic skin disorder characterized by thick, plate-like scales covering the skin, leading to significant health challenges.","Thickened skin, difficulty regulating body temperature, associated infections, dehydration, and other complications.",Regular medical monitoring and specialized skin care; protect skin from injury.,Intensive skin care; potential use of systemic retinoids; supportive care for associated complications.,A diet rich in healthy fats to support skin health; focus on hydration; consider supplements as advised by a healthcare provider to support skin barrier function.
Hashimoto’s thyroiditis,"An autoimmune disorder where the immune system attacks the thyroid gland, leading to hypothyroidism (underactive thyroid).","Fatigue, weight gain, cold intolerance, dry skin, hair loss, constipation, muscle weakness.",Regular monitoring of thyroid function; adherence to prescribed thyroid hormone replacement therapy.,Levothyroxine (synthetic thyroid hormone) to manage hypothyroidism.,"A balanced diet rich in iodine (if not contraindicated), selenium, and zinc; focus on whole foods; avoid excessive processed foods and sugars."
Hemangioma,"A benign tumor made up of blood vessels that often occurs in infants and young children, typically resolving without treatment.","Red or purple birthmark (vascular lesion), possible swelling, or complications if located in sensitive areas.",Regular monitoring; consult a healthcare provider if the hemangioma causes complications or is in a sensitive area.,Observation in many cases; corticosteroids or other medications if treatment is necessary.,A balanced diet to support overall health; ensure adequate hydration; avoid excessive processed foods.
Hemolytic uremic syndrome,"A serious condition characterized by hemolytic anemia, acute renal failure, and thrombocytopenia, often following an infection.","Abdominal pain, bloody diarrhea, fatigue, pale skin, decreased urination, swelling, high blood pressure.",Early medical intervention is crucial; monitor for signs of kidney damage; maintain hydration.,Supportive care; may require dialysis; medications to manage complications.,Focus on hydration and nutrient-rich foods; avoid high-protein diets if kidney function is impaired; consult a dietitian for specific dietary guidance.
Henoch-Schönlein purpura,"A small-vessel vasculitis primarily affecting children, characterized by a distinctive purplish rash, abdominal pain, and joint symptoms.","Purplish rash (often on buttocks and legs), abdominal pain, joint pain, kidney involvement (hematuria, proteinuria).",Regular monitoring for kidney function; avoid strenuous activities during flare-ups.,"Corticosteroids for severe cases, supportive care.","A balanced diet rich in fruits, vegetables, and hydration; anti-inflammatory foods may help manage symptoms."
Hereditary angioedema,"A genetic condition characterized by recurrent episodes of severe swelling (angioedema), often affecting the face, extremities, and gastrointestinal tract.","Recurrent episodes of swelling, often without itching; abdominal pain during gastrointestinal attacks; airway swelling can be life-threatening.","Avoid known triggers (stress, trauma, certain medications); carry emergency medication for severe attacks.","C1 inhibitor concentrate, androgens (danazol), and supportive care during episodes.",A well-balanced diet; avoid foods that may trigger allergic reactions or swelling; consult with a healthcare provider for specific dietary advice.
Hereditary hemorrhagic telangiectasia,"A genetic disorder that leads to abnormal blood vessel formation, causing bleeding and lesions in various organs.","Nosebleeds, telangiectasias (small red spots on the skin), gastrointestinal bleeding, anemia.",Regular monitoring for bleeding complications; avoid activities that could lead to injury or bleeding.,Supportive care for bleeding episodes; embolization for vascular lesions if necessary.,A diet rich in iron-rich foods to manage anemia; focus on overall nutrition to support health; avoid vitamin E and high-dose omega-3 fatty acids.
Hereditary spherocytosis,"A genetic condition leading to the production of abnormally shaped red blood cells (spherocytes), causing hemolytic anemia and splenomegaly.","Fatigue, jaundice, splenomegaly (enlarged spleen), gallstones, symptoms of anemia (pale skin, shortness of breath).",Regular monitoring for anemia; avoid infections due to splenomegaly; inform healthcare providers about the condition.,"Folic acid supplements, splenectomy in severe cases, supportive care for anemia.","Focus on a diet rich in folic acid (leafy greens, legumes) to support red blood cell production; avoid iron-rich foods if gallstones are a concern."
Hirschsprung disease,"A congenital condition resulting from the absence of nerve cells in part of the intestines, leading to severe constipation or intestinal obstruction.","Severe constipation, abdominal distension, poor feeding, growth failure in infants; older children may have fecal impaction.",Regular monitoring and follow-up; avoid foods that can cause constipation; consult with a healthcare provider for dietary guidance.,"Surgical intervention to remove the affected section of the bowel, supportive care for bowel management.",A high-fiber diet to promote bowel movement; stay hydrated; consult with a dietitian for specific guidance on managing constipation.
Histoplasmosis,"An infection caused by the fungus Histoplasma capsulatum, often found in bird droppings and bat caves, which can affect the lungs and other organs.","Cough, fever, fatigue, chest pain, shortness of breath, skin lesions in severe cases.",Avoid areas known to harbor the fungus; wear masks when cleaning areas with bird or bat droppings.,"Antifungal medications (itraconazole, amphotericin B for severe cases).",A well-balanced diet to support immune function; focus on hydration; avoid high-sugar and processed foods that may impact overall health.
Horner's syndrome,"A rare condition resulting from damage to the sympathetic nerves of the face, leading to a classic triad of symptoms.","Drooping eyelid (ptosis), constricted pupil (miosis), lack of sweating on one side of the face (anhidrosis).",Seek prompt medical evaluation for underlying causes; manage any associated conditions.,Treatment of the underlying cause; supportive care for symptoms.,A balanced diet; maintain hydration; consider a diet that supports overall nerve health (rich in omega-3 fatty acids and antioxidants).
Hunter syndrome,"A rare genetic disorder caused by the deficiency of the enzyme iduronate-2-sulfatase, leading to the accumulation of glycosaminoglycans.","Developmental delays, coarse facial features, joint stiffness, enlarged organs, respiratory issues.",Regular medical follow-ups; management of symptoms and complications; avoid infections.,"Enzyme replacement therapy (idursulfase), supportive therapies for symptoms.",A well-balanced diet to support overall health; focus on nutrient-dense foods; consult with a healthcare provider for specific dietary guidance.
Hurler syndrome,"A genetic disorder caused by the deficiency of the enzyme alpha-L-iduronidase, leading to the accumulation of glycosaminoglycans and affecting multiple organ systems.","Developmental delays, coarse facial features, enlarged organs, respiratory issues, hearing loss, skeletal abnormalities.",Regular medical monitoring; management of complications; consider genetic counseling for family planning.,"Enzyme replacement therapy (laronidase), hematopoietic stem cell transplant in severe cases.",A balanced diet to support overall health; focus on nutrient-dense foods; consider supplements as advised by a healthcare provider.
Hyper IgM syndrome,"A genetic immunodeficiency disorder characterized by the inability to produce immunoglobulin G (IgG) and immunoglobulin A (IgA), leading to increased susceptibility to infections.","Frequent infections, particularly respiratory and gastrointestinal; enlarged lymph nodes; autoimmune symptoms.",Regular medical monitoring; vaccinations as advised; maintain hygiene to reduce infection risk.,"Immunoglobulin replacement therapy, prophylactic antibiotics for infection prevention.",A well-balanced diet to support immune function; focus on hydration; avoid processed foods that may affect overall health.
Hyperaldosteronism,"A condition characterized by excessive production of aldosterone by the adrenal glands, leading to hypertension and electrolyte imbalances.","High blood pressure, low potassium levels (muscle weakness, fatigue), frequent urination, headaches.",Regular monitoring of blood pressure and electrolytes; avoid excessive sodium intake.,"Medications to block aldosterone (spironolactone), surgical removal of adrenal tumors if present.","A low-sodium diet to help manage blood pressure; focus on potassium-rich foods (bananas, oranges) if not contraindicated; consult with a dietitian for specific dietary guidance."
Hypercalcemia,"A condition characterized by high levels of calcium in the blood, which can result from various medical conditions.","Nausea, vomiting, constipation, increased thirst and urination, muscle weakness, confusion.",Regular monitoring of calcium levels; avoid excessive calcium intake from supplements.,"Treatment of the underlying cause; hydration to dilute calcium levels; medications (bisphosphonates, calcitonin) in severe cases.",A balanced diet; consult with a healthcare provider about calcium intake; avoid high-calcium foods if levels are elevated; focus on overall nutrition to support health.
Hypercholesterolemia,"A condition characterized by high levels of cholesterol in the blood, which can increase the risk of heart disease.","Often asymptomatic but can lead to cardiovascular symptoms (chest pain, shortness of breath) if severe.",Regular monitoring of cholesterol levels; avoid high-cholesterol and saturated-fat foods; maintain a healthy lifestyle.,"Statins, bile acid sequestrants, lifestyle modifications to lower cholesterol levels.","A heart-healthy diet: high in fruits, vegetables, whole grains, and lean proteins; low in saturated fats, trans fats, and added sugars. Incorporate healthy fats (avocado, nuts) in moderation."
Hyperemesis gravidarum,Severe nausea and vomiting during pregnancy.,"Extreme nausea, vomiting, dehydration, weight loss.","Rest, small frequent meals, hydration.","IV fluids, antiemetics (ondansetron), vitamins.","Bland diet, small meals, hydration (water, ginger tea)."
Hyperhidrosis,Excessive sweating not related to heat or exercise.,"Excessive sweating (palms, soles, armpits).","Avoid triggers (heat, stress), wear breathable fabrics.","Antiperspirants, botox injections, anticholinergics.","Hydration, avoid spicy foods, caffeine."
Hyperkalemia,High potassium levels in the blood.,"Fatigue, weakness, abnormal heart rhythm.","Monitor potassium intake, regular checkups.","Diuretics, potassium-binding agents.","Low-potassium diet (avoid bananas, potatoes)."
Hypokalemia,Low potassium levels in the blood.,"Weakness, fatigue, muscle cramps.","Potassium supplementation, avoid excessive diuretics.","Potassium supplements, potassium-sparing diuretics.","High-potassium foods (bananas, spinach, sweet potatoes)."
Hypomagnesemia,Low magnesium levels in the blood.,"Muscle cramps, weakness, irritability.","Adequate magnesium intake, avoid excess alcohol.","Magnesium supplements, IV magnesium in severe cases.","Magnesium-rich foods (nuts, seeds, leafy greens)."
Hypophosphatemia,Low phosphate levels in the blood.,"Muscle weakness, confusion, respiratory issues.","Adequate phosphate intake, avoid antacids.","Phosphate supplements, IV phosphate in severe cases.","Phosphate-rich foods (dairy, nuts, whole grains)."
Hypoplastic left heart syndrome,A congenital heart defect where the left side of the heart is underdeveloped.,"Rapid breathing, poor feeding, cyanosis.","Early diagnosis, frequent monitoring, surgery planning","Surgery (Norwood procedure), heart transplant.","High-calorie diet for infants, supplemental feeding."
Idiopathic intracranial hypertension,Increased pressure around the brain with no known cause.,"Headache, vision problems, nausea.","Regular eye exams, weight management.","Diuretics (acetazolamide), lumbar puncture.","Low-sodium diet, maintain healthy weight."
Idiopathic pulmonary fibrosis,Chronic lung disease causing lung tissue scarring.,"Shortness of breath, dry cough, fatigue.","Avoid smoking, exposure to lung irritants.","Antifibrotic drugs (pirfenidone), oxygen therapy.","Balanced diet, high-protein foods, avoid processed foods."
Idiopathic thrombocytopenic purpura,Immune disorder causing low platelet levels.,"Easy bruising, bleeding gums, nosebleeds.","Avoid blood-thinning medications, monitor bruising.","Corticosteroids, immunoglobulins, splenectomy in severe cases.","Iron-rich foods, balanced diet to support overall health."
Infective endocarditis,Infection of the heart valves or inner lining of the heart.,"Fever, chills, heart murmur, fatigue.","Maintain oral hygiene, avoid IV drug use.","Antibiotics, surgery for damaged heart valves.","Balanced diet, limit alcohol, adequate hydration."
