Disease,Description,Symptoms ,Precautions,Medications,Diets
Bell’s palsy,"A sudden, temporary weakness or paralysis of the facial muscles, usually on one side, often linked to viral infections.","Sudden facial drooping, inability to close the eye, drooling, loss of taste, pain around the jaw.","Manage stress, early treatment of viral infections, protect the eyes.","Corticosteroids, antiviral drugs, physical therapy, eye protection measures.","No specific diet, but focus on a balanced, nutrient-rich diet, include immune-boosting foods like fruits and vegetables, avoid alcohol and excessive sugar."
Bernard-Soulier syndrome,"A rare inherited bleeding disorder caused by a defect in platelet function, leading to prolonged bleeding.","Easy bruising, nosebleeds, prolonged bleeding from cuts, heavy menstrual periods.","Avoid blood-thinning medications, regular check-ups, inform doctors before surgery.","Platelet transfusions, antifibrinolytics, desmopressin in some cases.","Balanced diet, include iron-rich foods (e.g., leafy greens, lentils), and lean proteins, avoid alcohol, processed foods, and sugar."
Beta-thalassemia major,"A severe inherited blood disorder causing reduced hemoglobin production, leading to severe anemia and other complications.","Fatigue, pallor, jaundice, enlarged spleen, bone deformities, delayed growth.","Genetic counseling, regular monitoring, avoid iron-rich foods.","Regular blood transfusions, iron chelation therapy, bone marrow transplant.","Low-iron diet if iron overload is present, include calcium and vitamin D-rich foods, lean proteins, and avoid iron-rich foods like red meat and fortified cereals."
Biliary cirrhosis,"A chronic liver disease caused by the gradual destruction of the bile ducts within the liver, leading to liver damage.","Fatigue, itching, jaundice, swelling in the abdomen, bone pain.","Avoid alcohol, maintain a healthy diet, regular check-ups.","Ursodeoxycholic acid, immunosuppressants, liver transplant in severe cases.","Low-sodium, nutrient-rich diet, include lean proteins, whole grains, and fruits, avoid alcohol, fatty, and processed foods, ensure proper hydration."
Blastomycosis,"A fungal infection, primarily affecting the lungs, caused by inhaling spores of the fungus Blastomyces.","Fever, cough, chest pain, fatigue, weight loss, skin lesions (in severe cases).","Avoid areas with fungal spores (e.g., moist soil), use protective gear in high-risk areas.","Antifungal medications (itraconazole, amphotericin B).","Balanced diet, include immune-boosting foods like fruits, vegetables, and lean proteins, avoid processed and sugary foods, ensure adequate hydration."
Blue rubber bleb nevus syndrome,A rare condition characterized by multiple venous malformations (blue rubber blebs) in the skin and internal organs.,"Blue, rubbery nodules on the skin, gastrointestinal bleeding, pain in the affected areas.","Regular monitoring, avoid trauma to skin lesions, genetic counseling.","Laser therapy, surgery to remove or reduce lesions, iron supplements for anemia, blood transfusions in severe cases.","Balanced, nutrient-dense diet, include soft, easily digestible foods, avoid high-fiber and processed foods, ensure proper hydration."
Budd-Chiari syndrome,"A rare liver condition caused by blood clotting in the hepatic veins, leading to liver damage.","Abdominal pain, swelling, jaundice, enlarged liver, ascites.","Avoid blood-thinning medications, regular check-ups, manage clotting disorders.","Anticoagulants, thrombolytic therapy, liver transplant in severe cases.","Low-sodium, nutrient-rich diet, include lean proteins, fruits, vegetables, whole grains, avoid processed and high-fat foods, stay hydrated."
Carcinoid tumors,"Slow-growing tumors that arise in the hormone-producing cells of the body, often found in the lungs, digestive tract, or liver.","Flushing, diarrhea, abdominal pain, shortness of breath, wheezing.","Regular check-ups, avoid smoking, manage stress. ","Surgery to remove tumors, chemotherapy, hormone therapy, somatostatin analogs (octreotide).","Low-fat, low-fiber diet, include easily digestible foods, avoid spicy, fatty, and high-sugar foods, ensure proper hydration."
Carpal tunnel syndrome,"A condition caused by compression of the median nerve as it travels through the wrist, leading to pain, numbness, and tingling in the hand and arm.","Numbness or tingling in the hand, pain in the wrist, weakness in hand muscles.","Avoid repetitive hand movements, take regular breaks, use ergonomic equipment.","Splinting, corticosteroid injections, physical therapy, surgery in severe cases.","Anti-inflammatory diet, include omega-3-rich foods, fruits, vegetables, and lean proteins, avoid processed foods, sugar, and high-fat foods."
Castleman disease,"A rare disorder involving an overgrowth of cells in the lymph nodes, leading to symptoms similar to lymphoma.","Enlarged lymph nodes, fatigue, fever, night sweats, weight loss.","Regular monitoring, manage infections, avoid immunosuppressants without medical advice.","Immunotherapy (rituximab), corticosteroids, chemotherapy, surgery to remove lymph nodes in severe cases.","High-calorie, high-protein diet during treatment, include nutrient-dense, easily digestible foods, avoid processed and high-fat foods."
Cat-scratch disease,"A bacterial infection caused by Bartonella henselae, typically following a cat scratch or bite.","Swollen lymph nodes, fever, fatigue, headache, rash.","Avoid rough play with cats, clean cat scratches immediately, avoid stray cats.","Antibiotics (in severe cases), supportive care (pain relievers, hydration).","Balanced diet, include immune-boosting foods like fruits, vegetables, and lean proteins, avoid processed foods, sugar, and excessive fat."
Cerebral palsy,"A group of disorders affecting movement and muscle tone, caused by damage to the brain during development.","Muscle stiffness, poor coordination, tremors, difficulty walking, speech delays.","Early diagnosis and therapy, manage prenatal risk factors, ensure proper medical care during pregnancy and birth.","Physical therapy, speech therapy, medications to manage muscle spasms, surgery in severe cases.","High-calorie, high-protein diet, include nutrient-dense, easily digestible foods, avoid processed, sugary, and high-fat foods, ensure proper hydration."
Cervicitis,"Inflammation of the cervix, often caused by infections like chlamydia or gonorrhea, or non-infectious factors such as allergies or irritation.","Vaginal discharge, pain during intercourse, bleeding between periods, pelvic pain.","Safe sex practices, regular screenings, avoid irritants (e.g., douches).","Antibiotics (if caused by infection), antiviral medications (if caused by herpes), avoid irritants.","Balanced diet, include immune-boosting foods like fruits, vegetables, and lean proteins, avoid processed foods and sugar, stay hydrated."
Chagas disease,"A tropical parasitic disease caused by Trypanosoma cruzi, transmitted by insects.","Fever, swelling at the infection site, fatigue, enlarged liver or spleen, irregular heartbeats (in chronic cases).","Use insect repellents, avoid sleeping in thatch or mud houses, screen blood donors.","Antiparasitic medications (benznidazole, nifurtimox), medications to manage symptoms of chronic disease.","Balanced, nutrient-dense diet, include lean proteins, fruits, vegetables, and whole grains, avoid processed foods, sugar, and excessive salt."
Charcot-Marie-Tooth disease,"A hereditary disorder that affects the peripheral nerves, leading to muscle weakness and atrophy, especially in the legs and feet.","Muscle weakness, difficulty walking, loss of balance, foot deformities.","Genetic counseling, regular monitoring, physical therapy to manage symptoms.","Physical therapy, orthopedic devices (braces, custom shoes), surgery to correct deformities in severe cases.","Balanced diet, include nutrient-rich foods like fruits, vegetables, lean proteins, and whole grains, avoid processed foods, sugar, and high-fat foods."
Chikungunya,"A viral disease transmitted by mosquitoes, causing fever, joint pain, and other flu-like symptoms.","Sudden high fever, joint pain, muscle pain, headache, rash, fatigue.","Use insect repellents, wear protective clothing, avoid mosquito-infested areas.","Supportive care (pain relievers, hydration), no specific antiviral treatment available.","Hydration is key, include immune-boosting foods like fruits, vegetables, and lean proteins, avoid processed and sugary foods, ensure proper hydration."
Cholecystitis,"Inflammation of the gallbladder, often due to gallstones blocking the cystic duct.","Severe upper abdominal pain, nausea, vomiting, fever, jaundice.","Maintain a healthy diet, avoid high-fat foods, regular exercise, avoid rapid weight loss.","Antibiotics (for infection), surgery to remove the gallbladder (cholecystectomy), pain relievers.","Low-fat, nutrient-dense diet, include lean proteins, whole grains, fruits, and vegetables, avoid fatty, fried, and processed foods."
Chronic lymphocytic leukemia,"A type of cancer of the blood and bone marrow, affecting white blood cells (lymphocytes) and progressing slowly.","Fatigue, swollen lymph nodes, frequent infections, fever, weight loss.","Early diagnosis, regular monitoring, avoid exposure to chemicals and radiation.","Chemotherapy, targeted therapy, immunotherapy, bone marrow transplant in severe cases.","High-calorie, high-protein diet, include nutrient-dense, easily digestible foods, avoid processed and fatty foods, ensure proper hydration."
Chronic myeloid leukemia,"A type of cancer that starts in the blood-forming cells of the bone marrow and invades the blood, caused by a genetic mutation.","Fatigue, weight loss, night sweats, fever, bone pain, enlarged spleen.","Early diagnosis, regular check-ups, avoid exposure to radiation.","Tyrosine kinase inhibitors (imatinib), chemotherapy, stem cell transplant in severe cases.","High-calorie, high-protein diet, include nutrient-dense foods, avoid processed and sugary foods, stay hydrated, and manage weight."
Chronic venous insufficiency,"A condition in which the veins in the legs cannot pump enough blood back to the heart, leading to swelling and skin changes.","Swelling in the legs, pain or cramping, varicose veins, skin ulcers.","Regular exercise, avoid prolonged sitting or standing, wear compression stockings.","Compression therapy, medications to improve circulation, surgery in severe cases.","Balanced diet, include omega-3-rich foods, fruits, vegetables, lean proteins, avoid processed and high-sodium foods, ensure proper hydration."
Churg-Strauss syndrome,"A rare autoimmune disorder causing inflammation of blood vessels, often associated with asthma or allergies.","Asthma, sinus pain, fatigue, rash, weight loss, nerve damage, gastrointestinal issues.","Regular monitoring, manage asthma and allergies, avoid smoking.","Corticosteroids, immunosuppressants, biologics (e.g., mepolizumab).","Anti-inflammatory diet, include omega-3-rich foods, fruits, vegetables, whole grains, avoid processed foods, sugar, and high-fat foods, stay hydrated."
Coccidioidomycosis,"A fungal infection caused by inhaling spores of Coccidioides, found in soil in certain areas.","Fever, cough, chest pain, fatigue, joint pain, skin rashes.","Avoid areas with dust, use protective masks in high-risk areas.","Antifungal medications (fluconazole, itraconazole), supportive care for symptoms.","Balanced diet, include immune-boosting foods like fruits, vegetables, lean proteins, avoid processed foods, sugar, and high-fat foods, ensure proper hydration."
Congenital adrenal hyperplasia,"A group of inherited disorders affecting the adrenal glands, leading to abnormal production of hormones like cortisol and aldosterone.","Enlarged genitalia in newborns, early puberty, rapid growth, electrolyte imbalances, infertility.","Newborn screening, regular monitoring, genetic counseling.","Hormone replacement therapy (corticosteroids, mineralocorticoids), surgery to correct genital abnormalities.","Balanced diet, include lean proteins, fruits, vegetables, and whole grains, avoid processed foods, high-sugar, and high-sodium foods."
Congestive heart failure,"A chronic condition in which the heart is unable to pump enough blood to meet the body's needs, leading to fluid buildup in the lungs and other organs.","Shortness of breath, fatigue, swollen legs, rapid heartbeat, chest pain.","Regular check-ups, maintain a healthy diet, exercise regularly, avoid smoking.","Diuretics, beta-blockers, ACE inhibitors, surgery or devices like pacemakers in severe cases.","Low-sodium, heart-healthy diet, include omega-3-rich foods, fruits, vegetables, and whole grains, avoid processed foods, high-sodium, and high-fat foods."
Coronary artery disease,"A condition caused by the buildup of plaque in the arteries supplying blood to the heart, leading to chest pain, heart attack, or other complications.","Chest pain (angina), shortness of breath, fatigue, heart attack (in severe cases).","Maintain a healthy diet, regular exercise, avoid smoking, manage blood pressure and cholesterol.","Medications to manage cholesterol, blood pressure, and blood clots, surgery (angioplasty, bypass surgery) in severe cases.","Heart-healthy, Mediterranean-style diet, include omega-3-rich foods, fruits, vegetables, and whole grains, avoid high-fat, high-sodium, and processed foods."
Creutzfeldt-Jakob disease,"A rare, degenerative brain disorder caused by prions, leading to rapid mental deterioration and death.","Rapid mental deterioration, muscle stiffness, vision problems, involuntary movements, difficulty speaking or swallowing.","Avoid contact with infected tissues, ensure safety in medical procedures.","No cure, supportive care to manage symptoms, research into potential therapies ongoing.","No specific diet, but focus on easily digestible, nutrient-rich foods during progression of the disease, ensure proper hydration."
Cryptococcosis,"A fungal infection caused by Cryptococcus, primarily affecting the lungs and central nervous system, particularly in immunocompromised individuals.","Fever, cough, chest pain, headache, nausea, confusion, skin lesions.","Avoid areas with bird droppings, regular monitoring for immunocompromised individuals.","Antifungal medications (fluconazole, amphotericin B), supportive care in severe cases.","Balanced diet, include immune-boosting foods like fruits, vegetables, and lean proteins, avoid processed and sugary foods, ensure proper hydration."
Cryoglobulinemia,"A rare disorder characterized by abnormal proteins (cryoglobulins) in the blood that can lead to inflammation and organ damage, often associated with hepatitis.","Fatigue, joint pain, skin lesions, numbness or tingling, kidney problems, swelling of the extremities.","Regular monitoring, avoid cold temperatures, manage underlying infections (e.g., hepatitis).","Corticosteroids, immunosuppressants, antiviral therapy, plasmapheresis in severe cases.","Anti-inflammatory diet, include omega-3-rich foods, fruits, vegetables, lean proteins, avoid processed foods, sugar, and high-fat foods, stay hydrated."
Cystinuria,"A genetic disorder that leads to the formation of cystine stones in the kidneys, causing recurring kidney stones and urinary problems.","Flank pain, blood in urine, frequent urinary tract infections, kidney stones.","Drink plenty of fluids, avoid high-salt and high-protein diets, regular check-ups.","Medications to prevent stone formation (potassium citrate), surgery to remove stones in severe cases.","High-fluid intake to prevent kidney stones, avoid high-oxalate foods (e.g., spinach, beets), limit animal protein, salt, and processed foods."
De Quervain’s tenosynovitis,"A painful condition affecting the tendons on the thumb side of the wrist, often caused by overuse or repetitive motions.","Pain and swelling near the base of the thumb, difficulty moving the thumb and wrist, a ""sticking"" sensation when moving the thumb.","Avoid repetitive thumb and wrist movements, use ergonomic equipment, take breaks.","Splinting, corticosteroid injections, physical therapy, surgery in severe cases.","Anti-inflammatory diet, include omega-3-rich foods, fruits, vegetables, lean proteins, avoid processed foods, sugar, and high-fat foods."
Dercum’s disease,"A rare disorder characterized by painful fatty growths (lipomas) under the skin, leading to pain and swelling, often associated with obesity.","Painful fatty lumps, fatigue, weakness, depression, weight gain.","Maintain a healthy diet, regular exercise, avoid weight gain.","Pain relievers, corticosteroids, surgery to remove lipomas in severe cases.","Anti-inflammatory diet, include omega-3-rich foods, fruits, vegetables, whole grains, avoid processed foods, sugar, and high-fat foods, ensure hydration."
Dermatofibrosarcoma protuberans,"A rare type of cancer that begins in the skin's connective tissue, causing slow-growing tumors that can become aggressive if left untreated.","Firm, raised skin nodules, itching, tenderness, slowly enlarging lesions, ulceration in advanced cases.","Regular skin check-ups, avoid trauma to the affected area.","Surgery to remove tumors, radiation therapy, targeted therapy (imatinib) in advanced cases.","No specific dietary recommendation, but focus on a balanced, nutrient-dense diet to support general health and recovery."
Dermatographia,"A condition in which lightly scratching the skin causes raised, red lines or welts, usually due to an overactive immune response.","Raised red welts after scratching, itching, redness, swelling.","Avoid triggers (e.g., scratching, heat, stress), keep skin moisturized, manage stress.","Antihistamines, topical corticosteroids, avoiding known triggers.","No specific diet, but include anti-inflammatory foods, such as omega-3-rich foods, fruits, and vegetables, avoid processed foods and sugars."
Diabetic nephropathy,"Kidney damage caused by long-term uncontrolled diabetes, leading to chronic kidney disease and potential kidney failure.","Protein in urine, high blood pressure, swelling in the legs, frequent urination, fatigue.","Regular monitoring of blood sugar and blood pressure, maintain a healthy diet, avoid smoking.","Medications to control blood pressure (ACE inhibitors), diabetes management, dialysis or kidney transplant in severe cases.","Low-sodium, low-protein, heart-healthy diet, include whole grains, lean proteins, fruits, vegetables, avoid processed foods, high-sugar, and high-sodium foods."
Diabetic retinopathy,"A complication of diabetes that affects the eyes, caused by damage to the blood vessels in the retina, potentially leading to blindness.","Blurred vision, dark spots, vision loss, difficulty seeing at night.","Regular eye exams, maintain good blood sugar and blood pressure control, avoid smoking.","Laser therapy, injections (anti-VEGF), vitrectomy surgery in advanced cases.","Diabetes-friendly diet, include low-glycemic index foods, lean proteins, whole grains, fruits, vegetables, avoid processed foods, sugar, and excessive fat."
Diffuse idiopathic skeletal hyperostosis,"A form of arthritis that leads to the calcification of ligaments, particularly in the spine, causing stiffness and pain.","Stiffness in the spine, back pain, decreased range of motion, difficulty swallowing in some cases.","Regular exercise, maintain a healthy weight, avoid smoking.","Pain relievers (NSAIDs), physical therapy, surgery to remove bone growths in severe cases.","Anti-inflammatory diet, include omega-3-rich foods, lean proteins, fruits, and vegetables, avoid processed foods, sugar, and high-fat foods."
Disseminated intravascular coagulation (DIC),"A serious disorder causing abnormal blood clotting throughout the body's blood vessels, often triggered by infection or injury, leading to severe bleeding.","Severe bleeding, bruising, low blood pressure, organ failure.","Regular check-ups for at-risk individuals, avoid infections, manage trauma and sepsis early.","Blood transfusions, clotting factor replacement, anticoagulants in some cases.","No specific dietary treatment , but focused on balanced ,nutrient rich food,include lean proteins ,fruits , vegetable and whole grains , avoid processed food "
Dopa-responsive dystonia,"A rare genetic movement disorder characterized by progressive muscle contractions and stiffness, often improving with dopamine treatment.","Muscle stiffness, tremors, difficulty walking, worsens during the day.","Regular check-ups, genetic counseling, avoid strenuous activity.","Dopamine agonists (levodopa, carbidopa), physical therapy."," Balanced diet rich in fruits, vegetables, whole grains, and lean proteins,Avoid excessive caffeine and refined sugars."
Dressler’s syndrome,A type of pericarditis (inflammation of the sac around the heart) that occurs after heart surgery or heart attack.,"Chest pain, fever, fatigue, shortness of breath, palpitations.","Regular follow-ups after heart surgery, early treatment of heart-related symptoms.","Anti-inflammatory drugs (aspirin, NSAIDs), corticosteroids, colchicine.","Heart-healthy diet: low in saturated fats and cholesterol, high in omega-3 fatty acids (fish, flaxseed),limit sodium intake to manage blood pressure."
Echinococcosis (Hydatid disease),"A parasitic infection caused by the Echinococcus tapeworm, forming cysts in organs like the liver, lungs, and brain.","Cyst formation, abdominal pain, nausea, coughing, chest pain (lung cysts), jaundice (liver cysts).","Avoid contact with contaminated food or water, regular deworming in animals.","Antiparasitic drugs (albendazole), surgery to remove cysts, cyst aspiration."," Focus on a high-fiber diet to support gut health,Maintain hydration; consider herbal teas for digestive health."
Ehlers-Danlos syndrome,"A group of genetic disorders affecting connective tissues, leading to hypermobile joints, skin fragility, and tissue weakness.","Hypermobile joints, stretchy skin, easy bruising, chronic pain.","Avoid joint strain, regular monitoring, genetic counseling.","Pain management (NSAIDs), physical therapy, braces for joint support, surgery for severe cases.","Nutrient-dense diet with a focus on protein (lean meats, legumes) to support tissue health,Include foods rich in vitamins C and E for collagen production."
Eisenmenger syndrome,"A group of genetic disorders affecting connective tissues, leading to hypermobile joints, skin fragility, and tissue weakness.","Hypermobile joints, stretchy skin, easy bruising, chronic pain.","Avoid joint strain, regular monitoring, genetic counseling.","Pain management (NSAIDs), physical therapy, braces for joint support, surgery for severe cases.","Low-sodium diet to manage fluid retention, High in fruits, vegetables, whole grains; adequate protein sources."
Emphysema,"A complication of congenital heart disease where increased blood pressure in the lungs causes right-to-left heart shunt, leading to cyanosis and fatigue.","Cyanosis (bluish skin), shortness of breath, fatigue, chest pain, palpitations.","Avoid strenuous activity, prevent infections, avoid high altitudes.","Oxygen therapy, blood thinners, heart or lung transplant in severe cases.","Antioxidant-rich foods (berries, green leafy vegetables) to reduce inflammation, Adequate hydration to help thin mucus in the lungs."
Endometrial cancer,"A chronic lung condition, often caused by smoking, where the alveoli (air sacs) are damaged, leading to breathing difficulties.","Shortness of breath, chronic cough, wheezing, fatigue.","Avoid smoking, limit exposure to pollutants, regular exercise.","Bronchodilators, inhaled corticosteroids, oxygen therapy, pulmonary rehabilitation."," Plant-based diet rich in fiber; include whole grains, fruits, and vegetables,Limit red and processed meats, added sugars, and refined carbohydrates."
Eosinophilic esophagitis,"Cancer that starts in the lining of the uterus (endometrium), most common in postmenopausal women.","Abnormal vaginal bleeding, pelvic pain, weight loss, fatigue.","Regular pelvic exams, maintain a healthy weight, avoid smoking.","Surgery (hysterectomy), radiation therapy, chemotherapy, hormone therapy (in certain cases).","Elimination diet to identify food triggers; common culprits include dairy, soy, and gluten,Soft, easy-to-swallow foods; avoid allergens."
Ependymoma,"A chronic immune-mediated disease where eosinophils (a type of white blood cell) build up in the esophagus, causing inflammation and difficulty swallowing.","Difficulty swallowing, food impaction, chest pain, heartburn, nausea.","Avoid trigger foods (allergens), regular monitoring, avoid smoking.","Proton pump inhibitors, corticosteroids, elimination diet, esophageal dilation in severe cases.","Antioxidant-rich foods (fruits, vegetables) for overall health.,Adequate protein intake to support recovery post-treatment."
Erythema multiforme,"A rare type of tumor that arises from the ependymal cells in the brain and spinal cord, typically affecting children and young adults.","Headache, nausea, vomiting, seizures, balance problems, weakness or numbness (spinal cord tumors).","Regular monitoring, avoid radiation exposure, genetic counseling.","Surgery to remove the tumor, radiation therapy, chemotherapy in some cases.","Anti-inflammatory foods (turmeric, ginger, fatty fish) may help reduce symptoms,Avoid known allergens and irritants."
Erythromelalgia,"A skin reaction to infections or medications, characterized by red patches or target-like lesions, often associated with herpes simplex virus.","Red patches, blisters, itching, burning, fever, malaise.","Avoid triggers (medications or infections), treat underlying infections early","Antivirals (for HSV), corticosteroids, antihistamines, supportive care.","Anti-inflammatory diet rich in omega-3 fatty acids (salmon, walnuts) and antioxidants.- Avoid triggers like spicy foods and hot beverages."
